### ISSUE TITLE
[PTF-ARPTest] PTF container got DUT's response arp packet, but it decide test failed.

### ISSUE THREAD

**Issue by robert1030** [Azure/sonic-mgmt#1128]
**Description**
1. ARP test failed because DUT has been response ARP packet to PTF container, but arptest.py report it doesn't got packet.
2. Using tcpdum to check arp packet status on eth0 of docker-ptf, we can found DUT's response packets be arrived to eth0 of docker-ptf.

3. Failed Rate: Sometimes is VerifyUnicastARPReply, Sometimes is VerifyARPReply, by the issue example is failed on VerifyARPReply.

**Steps to reproduce the issue:**
1. To deploy PTF32 test Minigraph to DUT.
2. To check DUT, FanOut Switch and TestBed Server are link up.
3.  ssh to docker-pt container.
4. Do "tcpdump arp -vnXi eth0" on docker-ptf.
5. Run "ansible-playbook -vi lab -l sonic-ag9032v2a test_sonic.yml -e "testcase_name=arp testbed_type=ptf32 testbed_file=testbed.csv testbed_name=ptf-32"

**Describe the results you received:**
*1. DUT has been response ARP reply to eth0 of Docker-ptf.*

tcpdump: listening on eth0, link-type EN10MB (Ethernet), capture size 262144 bytes
06:41:42.468164 ARP, Ethernet (len 6), IPv4 (len 4), Request who-has 10.10.1.2 (6c:b9:c5:15:be:55) tell 10.10.1.3, length 46
        0x0000:  0001 0800 0604 0001 0006 0708 0900 0a0a  ................
        0x0010:  0103 6cb9 c515 be55 0a0a 0102 0000 0000  ..l....U........
        0x0020:  0000 0000 0000 0000 0000 0000 0000       ..............
06:41:42.468544 ARP, Ethernet (len 6), IPv4 (len 4), Reply 10.10.1.2 is-at 6c:b9:c5:15:be:55, length 46
        0x0000:  0001 0800 0604 0002 6cb9 c515 be55 0a0a  ........l....U..
        0x0010:  0102 0006 0708 0900 0a0a 0103 0000 0000  ................
        0x0020:  0000 0000 0000 0000 0000 0000 0000       ..............
06:41:47.143694 ARP, Ethernet (len 6), IPv4 (len 4), Request who-has 10.10.1.2 (ff:ff:ff:ff:ff:ff) tell 10.10.1.3, length 46
        0x0000:  0001 0800 0604 0001 0006 0708 090a 0a0a  ................
        0x0010:  0103 ffff ffff ffff 0a0a 0102 0000 0000  ................
        0x0020:  0000 0000 0000 0000 0000 0000 0000       ..............
06:41:47.143908 ARP, Ethernet (len 6), IPv4 (len 4), Reply 10.10.1.2 is-at 6c:b9:c5:15:be:55, length 46
        0x0000:  0001 0800 0604 0002 6cb9 c515 be55 0a0a  ........l....U..
        0x0010:  0102 0006 0708 090a 0a0a 0103 c06f 8cb5  .............o..
        0x0020:  0000 0000 0000 0000 0000 0000 0000       ..............
^C
4 packets captured

*2. BUT arptest.py to response test failed, because port0 can't got arp reply packet.*

TASK [test : Clear DUT arp cache] **********************************************
Wednesday 25 September 2019  06:41:45 +0000 (0:00:00.081)       0:00:24.303 *** 
changed: [sonic-ag9032v2a] => {"changed": true, "cmd": ["ip", "-stats", "neigh", "flush", "all"], "delta": "0:00:00.004907", "end": "2019-09-25 06:41:45.983509", "rc": 0, "start": "2019-09-25 06:41:45.978602", "stderr": "", "stdout": "\n*** Round 1, deleting 4 entries ***\n*** Flush is complete after 1 round ***", "stdout_lines": ["", "*** Round 1, deleting 4 entries ***", "*** Flush is complete after 1 round ***"], "warnings": []}

TASK [test : PTF funner Send correct arp packets (10.10.1.3 to 10.10.1.2 with src_mac=00:06:07:08:09:0a)] ***
Wednesday 25 September 2019  06:41:46 +0000 (0:00:00.208)       0:00:24.512 *** 
included: /var/sqa/sonic-mgmt/ansible/roles/test/tasks/ptf_runner.yml for sonic-ag9032v2a

TASK [test : fail] *************************************************************
Wednesday 25 September 2019  06:41:46 +0000 (0:00:00.221)       0:00:24.733 *** 
skipping: [sonic-ag9032v2a] => {"changed": false, "skip_reason": "Conditional check failed", "skipped": true}

TASK [test : PTF Test - ARP test] **********************************************
Wednesday 25 September 2019  06:41:46 +0000 (0:00:00.078)       0:00:24.811 *** 
ok: [sonic-ag9032v2a] => {
    "msg": "ptf --test-dir ptftests arptest.ExpectReply   --platform-dir ptftests  --platform remote  -t \"acs_mac='6c:b9:c5:15:be:55';port='0'\"  --relax --debug info --log-file /tmp/arptest.VerifyARPReply.2019-09-25-06:41:46.log  2>&1"
}

TASK [test : command] **********************************************************
Wednesday 25 September 2019  06:41:46 +0000 (0:00:00.126)       0:00:24.937 *** 
changed: [sonic-ag9032v2a -> 192.168.59.88] => {"changed": true, "cmd": "ptf --test-dir ptftests arptest.ExpectReply   --platform-dir ptftests  --platform remote  -t \"acs_mac='6c:b9:c5:15:be:55';port='0'\"  --relax --debug info --log-file /tmp/arptest.VerifyARPReply.2019-09-25-06:41:46.log  2>&1", "delta": "0:00:03.400177", "end": "2019-09-25 06:41:49.996064", "failed": false, "failed_when_result": false, "rc": 1, "start": "2019-09-25 06:41:46.595887", "stderr": "", "stdout": "arptest.ExpectReply ... FAIL\n\n======================================================================\nFAIL: arptest.ExpectReply\n----------------------------------------------------------------------\nTraceback (most recent call last):\n  File \"ptftests/arptest.py\", line 65, in runTest\n    verify_packet(self, exp_pkt, self.test_params['port'])\n  File \"/usr/lib/python2.7/dist-packages/ptf/testutils.py\", line 2405, in verify_packet\n    % (device, port, result.format()))\nAssertionError: Expected packet was not received on device 0, port 0.\n========== EXPECTED ==========\ndst        : DestMACField         = '00:06:07:08:09:0a' (None)\nsrc        : SourceMACField       = '6c:b9:c5:15:be:55' (None)\ntype       : XShortEnumField      = 2054            (0)\n--\nhwtype     : XShortField          = 1               (1)\nptype      : XShortEnumField      = 2048            (2048)\nhwlen      : ByteField            = 6               (6)\nplen       : ByteField            = 4               (4)\nop         : ShortEnumField       = 2               (1)\nhwsrc      : ARPSourceMACField    = '6c:b9:c5:15:be:55' (None)\npsrc       : SourceIPField        = '10.10.1.2'     (None)\nhwdst      : MACField             = '00:06:07:08:09:0a' ('00:00:00:00:00:00')\npdst       : IPField              = '10.10.1.3'     ('0.0.0.0')\n--\nload       : StrField             = '\\x00\\x00\\x00\\x00\\x00\\x00\\x00\\x00\\x00\\x00\\x00\\x00\\x00\\x00\\x00\\x00\\x00\\x00' ('')\n--\n0000   00 06 07 08 09 0A 6C B9  C5 15 BE 55 08 06 00 01   ......l....U....\n0010   08 00 06 04 00 02 6C B9  C5 15 BE 55 0A 0A 01 02   ......l....U....\n0020   00 06 07 08 09 0A 0A 0A  01 03 00 00 00 00 00 00   ................\n0030   00 00 00 00 00 00 00 00  00 00 00 00               ............\n========== RECEIVED ==========\n1 total packets. Displaying most recent 1 packets:\n------------------------------\ndst        : DestMACField         = '00:06:07:08:09:0a' (None)\nsrc        : SourceMACField       = '6c:b9:c5:15:be:55' (None)\ntype       : XShortEnumField      = 2054            (0)\n--\nhwtype     : XShortField          = 1               (1)\nptype      : XShortEnumField      = 2048            (2048)\nhwlen      : ByteField            = 6               (6)\nplen       : ByteField            = 4               (4)\nop         : ShortEnumField       = 2               (1)\nhwsrc      : ARPSourceMACField    = '6c:b9:c5:15:be:55' (None)\npsrc       : SourceIPField        = '10.10.1.2'     (None)\nhwdst      : MACField             = '00:06:07:08:09:0a' ('00:00:00:00:00:00')\npdst       : IPField              = '10.10.1.3'     ('0.0.0.0')\n--\nload       : StrField             = '\\xc0o\\x8c\\xb5\\x00\\x00\\x00\\x00\\x00\\x00\\x00\\x00\\x00\\x00\\x00\\x00\\x00\\x00' ('')\n--\n0000   00 06 07 08 09 0A 6C B9  C5 15 BE 55 08 06 00 01   ......l....U....\n0010   08 00 06 04 00 02 6C B9  C5 15 BE 55 0A 0A 01 02   ......l....U....\n0020   00 06 07 08 09 0A 0A 0A  01 03 C0 6F 8C B5 00 00   ...........o....\n0030   00 00 00 00 00 00 00 00  00 00 00 00               ............\n==============================\n\n\n----------------------------------------------------------------------\nRan 1 test in 2.009s\n\nFAILED (failures=1)", "stdout_lines": ["arptest.ExpectReply ... FAIL", "", "======================================================================", "FAIL: arptest.ExpectReply", "----------------------------------------------------------------------", "Traceback (most recent call last):", "  File \"ptftests/arptest.py\", line 65, in runTest", "    verify_packet(self, exp_pkt, self.test_params['port'])", "  File \"/usr/lib/python2.7/dist-packages/ptf/testutils.py\", line 2405, in verify_packet", "    % (device, port, result.format()))", "AssertionError: Expected packet was not received on device 0, port 0.", "========== EXPECTED ==========", "dst        : DestMACField         = '00:06:07:08:09:0a' (None)", "src        : SourceMACField       = '6c:b9:c5:15:be:55' (None)", "type       : XShortEnumField      = 2054            (0)", "--", "hwtype     : XShortField          = 1               (1)", "ptype      : XShortEnumField      = 2048            (2048)", "hwlen      : ByteField            = 6               (6)", "plen       : ByteField            = 4               (4)", "op         : ShortEnumField       = 2               (1)", "hwsrc      : ARPSourceMACField    = '6c:b9:c5:15:be:55' (None)", "psrc       : SourceIPField        = '10.10.1.2'     (None)", "hwdst      : MACField             = '00:06:07:08:09:0a' ('00:00:00:00:00:00')", "pdst       : IPField              = '10.10.1.3'     ('0.0.0.0')", "--", "load       : StrField             = '\\x00\\x00\\x00\\x00\\x00\\x00\\x00\\x00\\x00\\x00\\x00\\x00\\x00\\x00\\x00\\x00\\x00\\x00' ('')", "--", "0000   00 06 07 08 09 0A 6C B9  C5 15 BE 55 08 06 00 01   ......l....U....", "0010   08 00 06 04 00 02 6C B9  C5 15 BE 55 0A 0A 01 02   ......l....U....", "0020   00 06 07 08 09 0A 0A 0A  01 03 00 00 00 00 00 00   ................", "0030   00 00 00 00 00 00 00 00  00 00 00 00               ............", "========== RECEIVED ==========", "1 total packets. Displaying most recent 1 packets:", "------------------------------", "dst        : DestMACField         = '00:06:07:08:09:0a' (None)", "src        : SourceMACField       = '6c:b9:c5:15:be:55' (None)", "type       : XShortEnumField      = 2054            (0)", "--", "hwtype     : XShortField          = 1               (1)", "ptype      : XShortEnumField      = 2048            (2048)", "hwlen      : ByteField            = 6               (6)", "plen       : ByteField            = 4               (4)", "op         : ShortEnumField       = 2               (1)", "hwsrc      : ARPSourceMACField    = '6c:b9:c5:15:be:55' (None)", "psrc       : SourceIPField        = '10.10.1.2'     (None)", "hwdst      : MACField             = '00:06:07:08:09:0a' ('00:00:00:00:00:00')", "pdst       : IPField              = '10.10.1.3'     ('0.0.0.0')", "--", "load       : StrField             = '\\xc0o\\x8c\\xb5\\x00\\x00\\x00\\x00\\x00\\x00\\x00\\x00\\x00\\x00\\x00\\x00\\x00\\x00' ('')", "--", "0000   00 06 07 08 09 0A 6C B9  C5 15 BE 55 08 06 00 01   ......l....U....", "0010   08 00 06 04 00 02 6C B9  C5 15 BE 55 0A 0A 01 02   ......l....U....", "0020   00 06 07 08 09 0A 0A 0A  01 03 C0 6F 8C B5 00 00   ...........o....", "0030   00 00 00 00 00 00 00 00  00 00 00 00               ............", "==============================", "", "", "----------------------------------------------------------------------", "Ran 1 test in 2.009s", "", "FAILED (failures=1)"], "warnings": []}

TASK [test : debug] ************************************************************
Wednesday 25 September 2019  06:41:50 +0000 (0:00:03.612)       0:00:28.550 *** 
ok: [sonic-ag9032v2a] => {
    "out.stdout_lines": [
        "arptest.ExpectReply ... FAIL", 
        "", 
        "======================================================================", 
        "FAIL: arptest.ExpectReply", 
        "----------------------------------------------------------------------", 
        "Traceback (most recent call last):", 
        "  File \"ptftests/arptest.py\", line 65, in runTest", 
        "    verify_packet(self, exp_pkt, self.test_params['port'])", 
        "  File \"/usr/lib/python2.7/dist-packages/ptf/testutils.py\", line 2405, in verify_packet", 
        "    % (device, port, result.format()))", 
        "AssertionError: Expected packet was not received on device 0, port 0.", 
        "========== EXPECTED ==========", 
        "dst        : DestMACField         = '00:06:07:08:09:0a' (None)", 
        "src        : SourceMACField       = '6c:b9:c5:15:be:55' (None)", 
        "type       : XShortEnumField      = 2054            (0)", 
        "--", 
        "hwtype     : XShortField          = 1               (1)", 
        "ptype      : XShortEnumField      = 2048            (2048)", 
        "hwlen      : ByteField            = 6               (6)", 
        "plen       : ByteField            = 4               (4)", 
        "op         : ShortEnumField       = 2               (1)", 
        "hwsrc      : ARPSourceMACField    = '6c:b9:c5:15:be:55' (None)", 
        "psrc       : SourceIPField        = '10.10.1.2'     (None)", 
        "hwdst      : MACField             = '00:06:07:08:09:0a' ('00:00:00:00:00:00')", 
        "pdst       : IPField              = '10.10.1.3'     ('0.0.0.0')", 
        "--", 
        "load       : StrField             = '\\x00\\x00\\x00\\x00\\x00\\x00\\x00\\x00\\x00\\x00\\x00\\x00\\x00\\x00\\x00\\x00\\x00\\x00' ('')", 
        "--", 
        "0000   00 06 07 08 09 0A 6C B9  C5 15 BE 55 08 06 00 01   ......l....U....", 
        "0010   08 00 06 04 00 02 6C B9  C5 15 BE 55 0A 0A 01 02   ......l....U....", 
        "0020   00 06 07 08 09 0A 0A 0A  01 03 00 00 00 00 00 00   ................", 
        "0030   00 00 00 00 00 00 00 00  00 00 00 00               ............", 
        "========== RECEIVED ==========", 
        "1 total packets. Displaying most recent 1 packets:", 
        "------------------------------", 
        "dst        : DestMACField         = '00:06:07:08:09:0a' (None)", 
        "src        : SourceMACField       = '6c:b9:c5:15:be:55' (None)", 
        "type       : XShortEnumField      = 2054            (0)", 
        "--", 
        "hwtype     : XShortField          = 1               (1)", 
        "ptype      : XShortEnumField      = 2048            (2048)", 
        "hwlen      : ByteField            = 6               (6)", 
        "plen       : ByteField            = 4               (4)", 
        "op         : ShortEnumField       = 2               (1)", 
        "hwsrc      : ARPSourceMACField    = '6c:b9:c5:15:be:55' (None)", 
        "psrc       : SourceIPField        = '10.10.1.2'     (None)", 
        "hwdst      : MACField             = '00:06:07:08:09:0a' ('00:00:00:00:00:00')", 
        "pdst       : IPField              = '10.10.1.3'     ('0.0.0.0')", 
        "--", 
        "load       : StrField             = '\\xc0o\\x8c\\xb5\\x00\\x00\\x00\\x00\\x00\\x00\\x00\\x00\\x00\\x00\\x00\\x00\\x00\\x00' ('')", 
        "--", 
        "0000   00 06 07 08 09 0A 6C B9  C5 15 BE 55 08 06 00 01   ......l....U....", 
        "0010   08 00 06 04 00 02 6C B9  C5 15 BE 55 0A 0A 01 02   ......l....U....", 
        "0020   00 06 07 08 09 0A 0A 0A  01 03 C0 6F 8C B5 00 00   ...........o....", 
        "0030   00 00 00 00 00 00 00 00  00 00 00 00               ............", 
        "==============================", 
        "", 
        "", 
        "----------------------------------------------------------------------", 
        "Ran 1 test in 2.009s", 
        "", 
        "FAILED (failures=1)"
    ]
}

TASK [test : Set default PTF log filename] *************************************
Wednesday 25 September 2019  06:41:50 +0000 (0:00:00.120)       0:00:28.670 *** 
ok: [sonic-ag9032v2a] => {"ansible_facts": {"ptf_log_file": "/root/ptf.log", "ptf_log_file_param_index": "154"}, "changed": false}

TASK [test : Parse custom log filename specified in PTF command] ***************
Wednesday 25 September 2019  06:41:50 +0000 (0:00:00.119)       0:00:28.790 *** 
ok: [sonic-ag9032v2a] => {"ansible_facts": {"ptf_log_file": "/tmp/arptest.VerifyARPReply.2019-09-25-06:41:46.log"}, "changed": false}

TASK [test : Set PTF pcap filename] ********************************************
Wednesday 25 September 2019  06:41:50 +0000 (0:00:00.120)       0:00:28.910 *** 
ok: [sonic-ag9032v2a] => {"ansible_facts": {"ptf_pcap_file": "/tmp/arptest.VerifyARPReply.2019-09-25-06:41:46.pcap"}, "changed": false}

TASK [test : Fetch result files from switch to ansible machine] ****************
Wednesday 25 September 2019  06:41:50 +0000 (0:00:00.113)       0:00:29.024 *** 
skipping: [sonic-ag9032v2a] => (item=/tmp/arptest.VerifyARPReply.2019-09-25-06:41:46.log)  => {"changed": false, "item": "/tmp/arptest.VerifyARPReply.2019-09-25-06:41:46.log", "skip_reason": "Conditional check failed", "skipped": true}
skipping: [sonic-ag9032v2a] => (item=/tmp/arptest.VerifyARPReply.2019-09-25-06:41:46.pcap)  => {"changed": false, "item": "/tmp/arptest.VerifyARPReply.2019-09-25-06:41:46.pcap", "skip_reason": "Conditional check failed", "skipped": true}

TASK [test : debug] ************************************************************
Wednesday 25 September 2019  06:41:50 +0000 (0:00:00.407)       0:00:29.432 *** 
skipping: [sonic-ag9032v2a] => (item=/tmp/arptest.VerifyARPReply.2019-09-25-06:41:46.log)  => {"changed": false, "item": "/tmp/arptest.VerifyARPReply.2019-09-25-06:41:46.log", "skip_reason": "Conditional check failed", "skipped": true}
skipping: [sonic-ag9032v2a] => (item=/tmp/arptest.VerifyARPReply.2019-09-25-06:41:46.pcap)  => {"changed": false, "item": "/tmp/arptest.VerifyARPReply.2019-09-25-06:41:46.pcap", "skip_reason": "Conditional check failed", "skipped": true}

TASK [test : fail] *************************************************************
Wednesday 25 September 2019  06:41:51 +0000 (0:00:00.392)       0:00:29.824 *** 
fatal: [sonic-ag9032v2a]: FAILED! => {"changed": false, "failed": true, "msg": "Failed test 'ARP test'"}

*3. show arp on DUT, it record test arp mac address.*
root@sonic-ag9032v2a:/home/admin# show arp
Address         MacAddress         Iface      Vlan
--------------  -----------------  ---------  ------
10.10.1.3       00:06:07:08:09:0a  Ethernet0  -
192.168.59.14   56:e2:4c:e8:13:d7  eth0       -
192.168.59.254  bc:ae:c6:78:29:10  eth0       -
Total number of entries 3 

**Describe the results you expected:**
1. DUT has been response arp reply to eth0 of docker-ptf, it result should be pass.

**Additional information you deem important:**

    **Output of `show version`:**

    ```
    ONiC Software Version: SONiC.master.0-dirty-20190919.105145
Distribution: Debian 9.11
Kernel: 4.9.0-9-2-amd64
Build commit: 9d2d6172
Build date: Thu Sep 19 03:33:01 UTC 2019
Built by: hans@test-195

Platform: x86_64-delta_ag9032v2a-r0
HwSKU: Delta-ag9032v2a
ASIC: broadcom
Serial Number: A904F8DG187K00016
Uptime: 07:36:09 up 21:41,  1 user,  load average: 0.12, 0.19, 0.21

Docker images:
REPOSITORY                 TAG                              IMAGE ID            SIZE
docker-syncd-brcm          latest                           ee4d20db62db        392MB
docker-syncd-brcm          master.0-dirty-20190919.105145   ee4d20db62db        392MB
docker-fpm-frr             latest                           55cc363059c4        319MB
docker-fpm-frr             master.0-dirty-20190919.105145   55cc363059c4        319MB
docker-lldp-sv2            latest                           4f9623a79238        298MB
docker-lldp-sv2            master.0-dirty-20190919.105145   4f9623a79238        298MB
docker-dhcp-relay          latest                           884180677d98        289MB
docker-dhcp-relay          master.0-dirty-20190919.105145   884180677d98        289MB
docker-database            latest                           3b697d7b2e2f        281MB
docker-database            master.0-dirty-20190919.105145   3b697d7b2e2f        281MB
docker-teamd               latest                           8af078fc91f0        302MB
docker-teamd               master.0-dirty-20190919.105145   8af078fc91f0        302MB
docker-snmp-sv2            latest                           a2577ea1be43        334MB
docker-snmp-sv2            master.0-dirty-20190919.105145   a2577ea1be43        334MB
docker-orchagent           latest                           35e4212238f8        321MB
docker-orchagent           master.0-dirty-20190919.105145   35e4212238f8        321MB
docker-sflow               latest                           f5e576f53fa2        303MB
docker-sflow               master.0-dirty-20190919.105145   f5e576f53fa2        303MB
docker-sonic-telemetry     latest                           bceed511d058        304MB
docker-sonic-telemetry     master.0-dirty-20190919.105145   bceed511d058        304MB
docker-router-advertiser   latest                           3f0044363de1        281MB
docker-router-advertiser   master.0-dirty-20190919.105145   3f0044363de1        281MB
docker-platform-monitor    latest                           3d1c87b09763        326MB
docker-platform-monitor    master.0-dirty-20190919.105145   3d1c87b09763        326MB
    ```

 **Attach PTF arp pacp information result picture**
    ```
 1. [VerifyUnicastARPReply](https://drive.google.com/file/d/1BWBRRzQM9LBPTdDNOX7geCYb8n-glfl1/view?usp=sharing) 
    
 2. [VerifyARPReply](https://drive.google.com/file/d/1j6bbolGW3aVDi0IuZLKA07plZx_ObAv-/view?usp=sharing)
    ```
** TestBed Server information **
1. Server: HPE DL380 Gen10
2. CPU: Intel 6140 XEON 18 core * 2
3. OS: Ubuntu 16.04.6 (kernel: 4.15.0-64-generic)
4. Testbed Trunk Port Ethernet Card:
   sudo mlxfwmanager --query
   Device Type:      ConnectX4
   Part Number:      825110-B21_Ax_Bx
   Description:      HPE InfiniBand EDR/Ethernet 100Gb 1-port 840QSFP28 Adapter
   PSID:             HP_2180110032
   PCI Device Name:  /dev/mst/mt4115_pciconf0
   Base MAC:         040973e1cbf4
   Versions:         Current        Available     
     FW             12.25.1020     N/A           
     PXE            3.5.0701       N/A           
     UEFI           14.18.0019     N/A  
     Driver version:  MLNX_OFED_LINUX-4.6-1.0.1.1
