### ISSUE TITLE
Everflow: Mirror Payload does not match Expected packet

### ISSUE THREAD

**Issue by vivekreddynv** [Azure/sonic-mgmt#3270]
**Description**

This test (test_everflow_testbed.py) randomly fails on few test cases, every now and then.

**Steps to reproduce the issue:**
1. Take a t1-lag setup
2. Run the  everflow test 
3. `py.test everflow/test_everflow_testbed.py::TestEverflowV4IngressAclIngressMirror::test_everflow_basic_forwarding --inventory "../ansible/inventory, ../ansible/veos" --host-pattern  <duthostname>-t1-lag --module-path   ../ansible/library/ --testbed r-tigris-13-t1-lag --testbed_file ../ansible/testbed.csv   --assert plain --log-cli-level info --show-capture=no -ra --showlocals`

**Describe the results you received:**

```
Failed Samples (taken from different test runs):

22:59:37 INFO test_everflow_testbed.py:_run_everflow_test_scenarios:465: Sending packet with qualifier set (tcp flags) to DUT 
22:59:37 INFO everflow_test_utilities.py:send_and_check_mirror_packets:546: Received packet: Ether / 1.1.1.1 > 2.2.2.2 gre / GRE / Raw 
22:59:37 INFO everflow_test_utilities.py:send_and_check_mirror_packets:549: Received inner packet: Ether / IP / TCP 20.0.0.1:4660 > 30.0.0.10:http A / Raw 
22:59:37 INFO everflow_test_utilities.py:send_and_check_mirror_packets:569: Expected inner packet: Ether / IP / TCP 20.0.0.1:4660 > 30.0.0.1:http SA / Raw 

22:57:11 INFO test_everflow_testbed.py:_run_everflow_test_scenarios:465: Sending packet with qualifier set (dst ip) to DUT 
22:57:11 INFO everflow_test_utilities.py:send_and_check_mirror_packets:546: Received packet: Ether / 1.1.1.1 > 2.2.2.2 gre / GRE / Raw 
22:57:11 INFO everflow_test_utilities.py:send_and_check_mirror_packets:549: Received inner packet: Ether / IP / TCP 20.0.0.1:4675 > 30.0.0.1:http A / Raw 
22:57:11 INFO everflow_test_utilities.py:send_and_check_mirror_packets:569: Expected inner packet: Ether / IP / TCP 20.0.0.1:4660 > 30.0.0.10:http A / Raw 

23:23:57 INFO test_everflow_testbed.py:_run_everflow_test_scenarios:465: Sending packet with qualifier set (dscp) to DUT 
23:23:57 INFO everflow_test_utilities.py:send_and_check_mirror_packets:546: Received packet: Ether / 1.1.1.1 > 2.2.2.2 gre / GRE / Raw 
23:23:57 INFO everflow_test_utilities.py:send_and_check_mirror_packets:549: Received inner packet: Ether / IP / TCP 20.0.0.1:4660 > 30.0.0.1:4675 A / Raw 
23:23:57 INFO everflow_test_utilities.py:send_and_check_mirror_packets:569: Expected inner packet: Ether / IP / TCP 20.0.0.1:4660 > 30.0.0.1:http A / Raw
```

**Describe the results you expected:**

Test Should Pass

**Additional information you deem important:**

    **Output of `show version`:**

    ```
    (paste your output here)
    ```

    **Attach debug file `sudo generate_dump`:**

    ```
    (paste your output here)
    ```
