### ISSUE TITLE
[Vrf] test_bgp_with_loopback fails with Asn number mismatch 

### ISSUE THREAD

**Issue by AndriiLozovyi** [Azure/sonic-mgmt#2637]
**Description:**
After running test_bgp_with_loopback test ends up with an error "BGP instance name and AS number mismatch, BGP instance is already running; AS is 65100".  I see that it is a workaround to bgp socket issue:  
```
# FIXME Create a dummy bgp session.
# Workaroud to overcome the bgp socket issue.
# When there are only vrf bgp sessions and
# net.ipv4.tcp_l3mdev_accept=1, bgpd(7.0) does
# not create bgp socket for sessions.
duthost.shell("vtysh -c 'config terminal' -c 'router bgp 65444'")
```
Is this workaround still needed and actual ? 

**Steps to reproduce the issue:**
1)Deploy t0 topology.
2)Deploy minigrapgh on DUT
3)Run test_bgp_with_loopback

**Describe the results you received:**
```
>       duthost.shell("vtysh -c 'config terminal' -c 'router bgp 65444'")

E           RunAnsibleModuleFail: run module shell failed, Ansible Results =>
E           {"changed": true, "cmd": "vtysh -c 'config terminal' -c 'router bgp 65444'", "delta": "0:00:00.622185", "end": "2020-12-08 13:14:57.911876", "failed": true, "msg": "non-zero return code", "rc": 1, "start": "2020-12-08 13:14:57.289691", "stderr": "", "stderr_lines": [], "stdout": "BGP instance name and AS number mismatch\nBGP instance is already running; AS is 65100", "stdout_lines": ["BGP instance name and AS number mismatch", "BGP instance is already running; AS is 65100"]}

ERROR vrf/test_vrf.py::TestVrfLoopbackIntf::test_bgp_with_loopback
```
When I tried to comment out this line `duthost.shell("vtysh -c 'config terminal' -c 'router bgp 65444'")`,
test goes on but still fails on verifying bgp connection with peer.  
```
            # Verify bgp sessions are established
>           assert bgp_info['ipv4Unicast']['peers'][str(ptf_speaker_ip.ip)]['state'] == 'Established', \
                   "Bgp peer {} should be Established!".format(ptf_speaker_ip.ip)
E           KeyError: '10.255.0.1'

FAILED vrf/test_vrf.py::TestVrfLoopbackIntf::test_bgp_with_loopback
```
**Describe the results you expected:**
```
PASSED vrf/test_vrf.py::TestVrfLoopbackIntf::test_bgp_with_loopback
```

**Additional information you deem important:**

    **Output of `show version`:**

    ```
    SONiC Software Version: SONiC.master.35-dirty-20201112.031542
    Distribution: Debian 10.6
    Kernel: 4.19.0-9-2-amd64
    Build commit: 6c362a08
    Build date: Thu Nov 12 11:49:55 UTC 2020
    ```

    **Attach debug file `sudo generate_dump`:**

    ```
    (paste your output here)
    ```

**Comment by AndriiLozovyi** [comment]
@Minkang-Tsai @wangxin Could you please take a look ?

**Comment by Minkang-Tsai** [comment]
@AndriiLozovyi Add duthost.shell("vtysh -c 'config terminal' -c 'no router bgp 65100'") during setup?

**Comment by Minkang-Tsai** [comment]
@wangxin Could we replace 65444 BGP instance with 65100 BGP instance?

**Comment by AndriiLozovyi** [comment]
@Minkang-Tsai, I tried running test with `duthost.shell("vtysh -c 'config terminal' -c 'router bgp 65100'")` at setup, but the result didn't actually change. I still get this error: 
```
    @pytest.mark.usefixtures('setup_bgp_with_loopback')
    def test_bgp_with_loopback(self, duthosts, rand_one_dut_hostname, cfg_facts):
        duthost = duthosts[rand_one_dut_hostname]
        import pdb; pdb.set_trace()
>       peer_range = IPNetwork(cfg_facts['BGP_PEER_RANGE']['BGPSLBPassive']['ip_range'][0])
E       KeyError: '10.255.0.1'
```

And I don't quite understand were do we use Asn 65444, because I didn't found any else mentions of it in test and if to look at exabgp logs, it tries to connect to 65100 Asn. 

```
Thu, 10 Dec 2020 09:39:36 | INFO     | 1876   | configuration | loading | neighbor 10.1.0.32 {
Thu, 10 Dec 2020 09:39:36 | INFO     | 1876   | configuration | loading |     router-id 10.255.0.1;
Thu, 10 Dec 2020 09:39:36 | INFO     | 1876   | configuration | loading |     local-address 10.255.0.1;
Thu, 10 Dec 2020 09:39:36 | INFO     | 1876   | configuration | loading |     peer-as 65100;
Thu, 10 Dec 2020 09:39:36 | INFO     | 1876   | configuration | loading |     local-as 65432;
Thu, 10 Dec 2020 09:39:36 | INFO     | 1876   | configuration | loading |     auto-flush false;
Thu, 10 Dec 2020 09:39:36 | INFO     | 1876   | configuration | loading |     group-updates true;
Thu, 10 Dec 2020 09:39:36 | INFO     | 1876   | configuration | loading |     static {
Thu, 10 Dec 2020 09:39:36 | INFO     | 1876   | configuration | loading |         route 10.10.10.0/26 next-hop 192.168.0.2;
Thu, 10 Dec 2020 09:39:36 | INFO     | 1876   | configuration | loading |     }
Thu, 10 Dec 2020 09:39:36 | INFO     | 1876   | configuration | loading | }
```
Also as seen in exabgp logs, tcp session fails to establish, because DUT is remotely closing it for some reason.
 ```
Thu, 10 Dec 2020 09:39:39 | INFO     | 1876   | network       | Peer       10.1.0.32 ASN 65100   out loop, peer reset, message [closing connection] error[the TCP connection was closed by the remote end]
```

The same picture I saw when I tried to sniff packets with tcpdump on PTF: 
```
10.255.0.1.37021 > 10.1.0.32.179: Flags [S], cksum 0x154f (incorrect -> 0xd8f6), seq 1127316577, win 64232, options [mss 9176,sackOK,TS val 3667662166 ecr 0,nop,wscale 13], length 0
        0x0000:  0090 fb60 e268 bad4 bc55 8752 0800 4500
        0x0010:  003c 0a02 4000 4006 1b9a 0aff 0001 0a01
        0x0020:  0020 909d 00b3 4331 7c61 0000 0000 a002
        0x0030:  fae8 154f 0000 0204 23d8 0402 080a da9c
        0x0040:  1556 0000 0000 0103 030d
09:43:35.300404 IP (tos 0xc0, ttl 255, id 0, offset 0, flags [DF], proto TCP (6), length 60)
    10.1.0.32.179 > 10.255.0.1.37021: Flags [S.], cksum 0x18f3 (correct), seq 3592714580, ack 1127316578, win 63336, options [mss 1460,sackOK,TS val 891706621 ecr 3667662166,nop,wscale 7], length 0
        0x0000:  bad4 bc55 8752 0090 fb60 e268 0800 45c0
        0x0010:  003c 0000 4000 ff06 65db 0a01 0020 0aff
        0x0020:  0001 00b3 909d d624 7954 4331 7c62 a012
        0x0030:  f768 18f3 0000 0204 05b4 0402 080a 3526
        0x0040:  5cfd da9c 1556 0103 0307
09:43:35.300438 IP (tos 0x0, ttl 64, id 2563, offset 0, flags [DF], proto TCP (6), length 52)
    10.255.0.1.37021 > 10.1.0.32.179: Flags [.], cksum 0x1547 (incorrect -> 0x3f20), seq 1, ack 1, win 8, options [nop,nop,TS val 3667662166 ecr 891706621], length 0
        0x0000:  0090 fb60 e268 bad4 bc55 8752 0800 4500
        0x0010:  0034 0a03 4000 4006 1ba1 0aff 0001 0a01
        0x0020:  0020 909d 00b3 4331 7c62 d624 7955 8010
        0x0030:  0008 1547 0000 0101 080a da9c 1556 3526
        0x0040:  5cfd
09:43:35.301039 IP (tos 0xc0, ttl 255, id 60441, offset 0, flags [DF], proto TCP (6), length 52)
    10.1.0.32.179 > 10.255.0.1.37021: Flags [F.], cksum 0x3d37 (correct), seq 1, ack 1, win 495, options [nop,nop,TS val 891706622 ecr 3667662166], length 0
        0x0000:  bad4 bc55 8752 0090 fb60 e268 0800 45c0
        0x0010:  0034 ec19 4000 ff06 79c9 0a01 0020 0aff
        0x0020:  0001 00b3 909d d624 7955 4331 7c62 8011
        0x0030:  01ef 3d37 0000 0101 080a 3526 5cfe da9c
        0x0040:  1556
09:43:35.302908 IP (tos 0x0, ttl 64, id 2564, offset 0, flags [DF], proto TCP (6), length 52)
    10.255.0.1.37021 > 10.1.0.32.179: Flags [.], cksum 0x1547 (incorrect -> 0x3f1b), seq 1, ack 2, win 8, options [nop,nop,TS val 3667662169 ecr 891706622], length 0
        0x0000:  0090 fb60 e268 bad4 bc55 8752 0800 4500
        0x0010:  0034 0a04 4000 4006 1ba0 0aff 0001 0a01
        0x0020:  0020 909d 00b3 4331 7c62 d624 7956 8010
        0x0030:  0008 1547 0000 0101 080a da9c 1559 3526
        0x0040:  5cfe

10.255.0.1.37021 > 10.1.0.32.179: Flags [F.], cksum 0x1547 (incorrect -> 0x36cd), seq 126, ack 2, win 8, options [nop,nop,TS val 3667664169 ecr 891706622], length 0
        0x0000:  0090 fb60 e268 bad4 bc55 8752 0800 4500
        0x0010:  0034 0a06 4000 4006 1b9e 0aff 0001 0a01
        0x0020:  0020 909d 00b3 4331 7cdf d624 7956 8011
        0x0030:  0008 1547 0000 0101 080a da9c 1d29 3526
        0x0040:  5cfe
09:43:37.302807 IP (tos 0x0, ttl 64, id 0, offset 0, flags [DF], proto TCP (6), length 40)
    10.1.0.32.179 > 10.255.0.1.37021: Flags [R], cksum 0xb9f4 (correct), seq 3592714582, win 0, length 0
        0x0000:  bad4 bc55 8752 0090 fb60 e268 0800 4500
        0x0010:  0028 0000 4000 4006 25b0 0a01 0020 0aff
        0x0020:  0001 00b3 909d d624 7956 0000 0000 5004
        0x0030:  0000 b9f4 0000 0000 0000 0000
```
